dd_Smed_v6_756_0_1	19135.948	Argonaute/Ago	sp|Q7PLK0|AGO3_DROME Protein argonaute-3 OS=Drosophila melanogaster OX=7227 GN=AGO3 PE=1 SV=3
dd_Smed_v6_659_0_1	14806.434	Argonaute/Ago	sp|Q7PLK0|AGO3_DROME Protein argonaute-3 OS=Drosophila melanogaster OX=7227 GN=AGO3 PE=1 SV=3
dd_Smed_v6_1258_0_1	14151.070	Argonaute/Ago	sp|Q7PLK0|AGO3_DROME Protein argonaute-3 OS=Drosophila melanogaster OX=7227 GN=AGO3 PE=1 SV=3
dd_Smed_v6_7594_0_1	3932.123	Argonaute/Ago	sp|Q6DCX2|AGO2_XENLA Protein argonaute-2 OS=Xenopus laevis OX=8355 GN=ago2 PE=2 SV=1
dd_Smed_v6_1194_0_3	3713.029	Argonaute/Ago	sp|O77503|AGO2_RABIT Protein argonaute-2 (Fragment) OS=Oryctolagus cuniculus OX=9986 GN=AGO2 PE=1 SV=2
dd_Smed_v6_3861_0_1	3568.683	Argonaute/Ago	sp|Q9UKV8|AGO2_HUMAN Protein argonaute-2 OS=Homo sapiens OX=9606 GN=AGO2 PE=1 SV=3
